Id,URL,Headline,Author,Date
0,www.theverge.com/2022/9/20/23363345/tesla-megapack-battery-fire-california-monterey-pg-and-e,"Tesla Megapack battery fire is ‘fully controlled,’ shelter-in-place advisory lifted",Umar Shakir,Two hours ago
1,www.theverge.com/2022/9/13/23349876/the-verge-website-redesign-new-newsfeed-blogs-logo,Welcome to the new Verge,Nilay Patel,Sep 13
2,www.theverge.com/authors/tom-warren,Nvidia announces next-gen RTX 4090 and RTX 4080 GPUs,Tom Warren,Sep 20
3,www.theverge.com/authors/umar-shakir,"Tesla Megapack battery fire is ‘fully controlled,’ shelter-in-place advisory lifted",Umar Shakir,Sep 21
4,www.theverge.com/authors/tom-warren,Windows 11’s 2022 Update has something new for everyone,Tom Warren,Sep 20
5,www.theverge.com/authors/richard-lawler,Judge cuts $7 billion Charter Spectrum verdict for family of a murdered customer to $1 billion,Richard Lawler,Sep 20
6,www.theverge.com/authors/jay-peters,Apple makes the battery indicator better in new iOS 16.1 beta,Jay Peters,Sep 20
7,www.theverge.com/2022/9/20/23363345/tesla-megapack-battery-fire-california-monterey-pg-and-e?itm_source=parsely-api,Nvidia announces next-gen RTX 4090 and RTX 4080 GPUs,Tom Warren,Sep 20
8,www.theverge.com/23361782/peloton-row-hands-on-rower-connected-fitness?itm_source=parsely-api,Tesla Megapack battery fire spurs shelter-in-place warning in California,Umar Shakir,Sep 20
9,www.theverge.com/2022/9/18/23359156/gta-6-leak-gameplay-footage-90-videos?itm_source=parsely-api,Peloton Row hands-on: pretty much what you’d expect,Victoria Song,Sep 20
10,www.theverge.com/23359304/microsoft-windows-11-2022-update-review?itm_source=parsely-api,GTA 6 gameplay leaks online in 90 videos,Tom Warren,Sep 18
11,www.theverge.com/policy,Windows 11’s 2022 Update has something new for everyone,Tom Warren,Sep 20
12,www.theverge.com/authors/nilay-patel,Can software simplify the supply chain? Ryan Petersen thinks so,Nilay Patel,Sep 20
13,www.theverge.com/authors/alex-cranz,Music labels are incorporating old songs into new songs to trigger your nostalgia.,Alex Cranz,Sep 19
14,www.theverge.com/authors/alex-cranz,Will the future of music sound a lot like the past?,Alex Cranz,Sep 19
15,www.theverge.com/authors/andrew-marino,"Vergecast: reviews of the iPhone 14 Pro, Apple Watch Series 8, and more",Andrew Marino,Sep 16
16,www.theverge.com/authors/andrew-marino,Listen to our podcast about our website redesign,Andrew Marino,Sep 14
17,www.theverge.com/authors/ash-parrish,Streamer involved in Twitch gambling saga now embroiled in sexual assault allegations,Ash Parrish,Sep 20
18,www.theverge.com/authors/mia-sato,YouTube will let creators monetize videos with licensed music,Mia Sato,Sep 20
19,www.theverge.com/authors/william-joel,Making It Work 2021,William Joel,Aug 23
20,www.theverge.comhttps://www.theverge.com/2022/9/20/23362864/hacker-crypto-steal-wintermute-theft,"Yes, it happened again.",Ash Parrish,Sep 20
21,www.theverge.com/2022/9/16/23356279/youtube-shorts-monetization-ads-partner-program-tiktok,YouTube is turning on the money hose for Shorts — and taking on TikTok for real,David Pierce,Sep 16
22,www.theverge.com/23190907/iphone-lock-screen-customize-ios-16-photo-shuffle-emoji-widgets,How to personalize your iOS 16 lock screen with widgets and wallpaper,Barbara Krasnoff,Sep 20
23,www.theverge.com/2021/9/13/22671207/deathloop-review-ps5-pc,Deathloop is an intricate mystery that also happens to be an amazing action game,Andrew Webster,"Sep 13, 2021"
24,www.theverge.com/2022/9/20/23364080/twitch-gambling-ban-stake-slots-roulette-dice-games,Twitch to ban Stake.com streams and other unlicensed gambling content,Ash Parrish,Sep 20
25,www.theverge.com/2022/9/20/23363892/overwatch-2-lead-hero-designer-resigns-blizzard,Overwatch 2 loses lead hero designer just before sequel launches,Ash Parrish,Sep 20
26,www.theverge.com/2022/9/20/23363663/razer-leviathan-v2-x-pc-soundbar-compact-rgb,"Razer releases cheaper, more compact Leviathan V2 X PC soundbar",Emma Roth,Sep 20
27,www.theverge.com/2022/9/20/23363546/meta-quest-vr-v44-update-advanced-camera-settings-stabilization,The new Quest update will stabilize your shaky VR recordings,Mitchell Clark,Sep 20
28,www.theverge.com/2022/9/20/23363760/mizkif-trainwreckstv-sexual-harassment-twitch-adrianahlee,Streamer involved in Twitch gambling saga now embroiled in sexual assault allegations,Ash Parrish,Sep 20
29,www.theverge.com/2022/9/20/23363660/apple-ios-16-haptic-keyboard-feedback-battery-life,Turning on haptic keyboard feedback in iOS 16 could affect your battery life,Jay Peters,Sep 20
30,www.theverge.com/2022/9/20/23363571/charter-spectrum-betty-thomas-murder-forgery-damages,Judge cuts $7 billion Charter Spectrum verdict for family of a murdered customer to $1 billion,Richard Lawler,Sep 20
31,www.theverge.com/2022/9/20/23363205/google-train-tickets-travel-flights-carbon-emissions,Google search can help you buy train tickets in select countries,Jasmine Hicks,Sep 20
32,www.theverge.com/2022/9/20/23363513/apple-ios-16-1-beta-2-battery-indicator,Apple makes the battery indicator better in new iOS 16.1 beta,Jay Peters,Sep 20
33,www.theverge.com/2022/9/20/23363443/youtube-creator-music-licensing-program-monetizing-longform-videos,YouTube will let creators monetize videos with licensed music,Mia Sato,Sep 20
34,www.theverge.com/23190907/iphone-lock-screen-customize-ios-16-photo-shuffle-emoji-widgets,How to personalize your iOS 16 lock screen with widgets and wallpaper,Barbara Krasnoff,Sep 20
35,www.theverge.com/2022/9/20/23363056/the-midnight-clubs-trailer-netflix,The Midnight Club’s first trailer looks like The Fault in Our Stars but with vengeful ghosts,Charles Pulliam-Moore,Sep 20
36,www.theverge.com/2022/9/20/23363323/motorola-e22-e22i-budget-phone-design-specs-price-screen,Motorola’s new budget phones look surprisingly nice,Allison Johnson,Sep 20
37,www.theverge.com/2022/9/20/23363257/american-airlines-data-breach-disclosure-phishing,American Airlines reveals data breach — two months after it was discovered,Mitchell Clark,Sep 20
38,www.theverge.com/2022/9/20/23363289/sonic-prime-netflix-teaser-trailer-multiverse-release-window,Netflix’s new Sonic show will be released this winter,Jay Peters,Sep 20
39,www.theverge.com/2022/9/20/23363286/hulu-hellraiser-trailer-jamie-clayton,Hulu’s Hellraiser reboot is full of puzzles and promise in new trailer,Andrew Webster,Sep 20
40,www.theverge.com/2022/9/20/23362662/microsoft-windows-11-2022-update-release-download,Here’s how Microsoft is rolling out its first major update to Windows 11,Tom Warren,Sep 20
41,www.theverge.com/23359304/microsoft-windows-11-2022-update-review,Windows 11’s 2022 Update has something new for everyone,Tom Warren,Sep 20
42,www.theverge.com/2022/9/20/23362959/vampire-survivors-steam-deck-pc-indie-game-price-increase-deal-sale,Deals PSA: Today’s the last day to buy Vampire Survivors on Steam for just $2.99,Antonio G. Di Benedetto,Sep 20
43,www.theverge.com/2022/9/20/23363235/apple-antitrust-spotify-epic-games-fortnite-lobbying,Apple quietly bankrolled a lobbying group for app developers,Makena Kelly,Sep 20
44,www.theverge.com/2022/9/20/23362990/nvidia-dlss-3-0-demonstration-ada-lovelace-graphics-cards-upscaling-technology,"Nvidia shows off DLSS 3, the new version of its impressive upscaling tech",Jon Porter,Sep 20
